{
  "engine": {
    "provider": "semif",
    "requested_model": "semif-qwen3.5-4b-mlx-q4-851bf6e8",
    "resolved_model": "semif-qwen3.5-4b-mlx-q4-851bf6e8",
    "run_id": "6c6a4232b9e0fff10dbf318f",
    "schema_sha256": "sha256:9314b38daf329f4c61fbea3d64f9a76a8d6334511888dcd61f7c75563c8f7094"
  },
  "inputs": {
    "decision_schema_sha256": "sha256:9314b38daf329f4c61fbea3d64f9a76a8d6334511888dcd61f7c75563c8f7094",
    "labels_sha256": "fd4d2489bb594ff433db5bb8cf174381212b365d69b2bbc9ce42bdab01dc7b73",
    "predictions_sha256": "840adb6fae1ed5ecc3e21b8fcb4ea64c3bf139921e23a5f5b06b7fd5ca2ac5da",
    "records_sha256": "ac239a2fd52f3e8c474e708c426aafa21c785a8a9517644e59a32b3f8fc16450"
  },
  "locked_test_unlocked": false,
  "operations": {
    "cost_usd_per_1000_records": null,
    "errors_by_type": {},
    "input_tokens": 1515670,
    "latency_ms": {
      "p50": 9577.0,
      "p95": 11498.149999999996,
      "p99": 12233.889999999996
    },
    "output_tokens": 0,
    "total_cost_usd": null
  },
  "partial_evaluation": false,
  "questions": {
    "actionable_feedback": {
      "accuracy": 0.9520833333333333,
      "auprc": 0.9991230575083748,
      "auroc": 0.9750984627112184,
      "brier": 0.029940121100662038,
      "confusion": {
        "fn": 15,
        "fp": 8,
        "tn": 9,
        "tp": 448
      },
      "ece": 0.0230051280530008,
      "evaluated_count": 480,
      "f1": 0.9749727965179543,
      "precision": 0.9824561403508771,
      "primitive": "noul",
      "recall": 0.9676025917926566,
      "selective": [
        {
          "accepted": 480,
          "accuracy": 0.9520833333333333,
          "coverage": 1.0,
          "risk": 0.04791666666666672,
          "threshold": 0.0
        },
        {
          "accepted": 480,
          "accuracy": 0.9520833333333333,
          "coverage": 1.0,
          "risk": 0.04791666666666672,
          "threshold": 0.5
        },
        {
          "accepted": 480,
          "accuracy": 0.9520833333333333,
          "coverage": 1.0,
          "risk": 0.04791666666666672,
          "threshold": 0.6
        },
        {
          "accepted": 473,
          "accuracy": 0.9619450317124736,
          "coverage": 0.9854166666666667,
          "risk": 0.038054968287526414,
          "threshold": 0.7
        },
        {
          "accepted": 440,
          "accuracy": 0.9954545454545455,
          "coverage": 0.9166666666666666,
          "risk": 0.004545454545454519,
          "threshold": 0.8
        },
        {
          "accepted": 436,
          "accuracy": 0.9954128440366973,
          "coverage": 0.9083333333333333,
          "risk": 0.004587155963302725,
          "threshold": 0.9
        },
        {
          "accepted": 436,
          "accuracy": 0.9954128440366973,
          "coverage": 0.9083333333333333,
          "risk": 0.004587155963302725,
          "threshold": 0.95
        },
        {
          "accepted": 382,
          "accuracy": 1.0,
          "coverage": 0.7958333333333333,
          "risk": 0.0,
          "threshold": 0.99
        }
      ],
      "total_count": 480
    },
    "defect_type": {
      "accuracy": 0.9166666666666666,
      "brier": 0.02083577120689311,
      "confusion_matrix": {
        "compatibility": {
          "compatibility": 0,
          "missing_component": 0,
          "noise": 0,
          "other": 0,
          "physical_damage": 0,
          "stability": 0,
          "thermal": 0,
          "unclear": 0
        },
        "missing_component": {
          "compatibility": 0,
          "missing_component": 0,
          "noise": 0,
          "other": 0,
          "physical_damage": 0,
          "stability": 0,
          "thermal": 0,
          "unclear": 0
        },
        "noise": {
          "compatibility": 0,
          "missing_component": 0,
          "noise": 21,
          "other": 0,
          "physical_damage": 0,
          "stability": 0,
          "thermal": 0,
          "unclear": 0
        },
        "other": {
          "compatibility": 0,
          "missing_component": 0,
          "noise": 0,
          "other": 0,
          "physical_damage": 0,
          "stability": 0,
          "thermal": 0,
          "unclear": 4
        },
        "physical_damage": {
          "compatibility": 0,
          "missing_component": 0,
          "noise": 0,
          "other": 0,
          "physical_damage": 21,
          "stability": 0,
          "thermal": 0,
          "unclear": 0
        },
        "stability": {
          "compatibility": 0,
          "missing_component": 0,
          "noise": 0,
          "other": 0,
          "physical_damage": 0,
          "stability": 15,
          "thermal": 0,
          "unclear": 0
        },
        "thermal": {
          "compatibility": 0,
          "missing_component": 0,
          "noise": 0,
          "other": 0,
          "physical_damage": 0,
          "stability": 0,
          "thermal": 0,
          "unclear": 0
        },
        "unclear": {
          "compatibility": 36,
          "missing_component": 0,
          "noise": 0,
          "other": 0,
          "physical_damage": 0,
          "stability": 0,
          "thermal": 0,
          "unclear": 383
        }
      },
      "ece": 0.08718396734799354,
      "evaluated_count": 480,
      "macro_f1": 0.49379652605459057,
      "per_class": {
        "compatibility": {
          "f1": 0.0,
          "precision": 0.0,
          "recall": 0.0,
          "support": 0
        },
        "missing_component": {
          "f1": 0.0,
          "precision": 0.0,
          "recall": 0.0,
          "support": 0
        },
        "noise": {
          "f1": 1.0,
          "precision": 1.0,
          "recall": 1.0,
          "support": 21
        },
        "other": {
          "f1": 0.0,
          "precision": 0.0,
          "recall": 0.0,
          "support": 4
        },
        "physical_damage": {
          "f1": 1.0,
          "precision": 1.0,
          "recall": 1.0,
          "support": 21
        },
        "stability": {
          "f1": 1.0,
          "precision": 1.0,
          "recall": 1.0,
          "support": 15
        },
        "thermal": {
          "f1": 0.0,
          "precision": 0.0,
          "recall": 0.0,
          "support": 0
        },
        "unclear": {
          "f1": 0.9503722084367245,
          "precision": 0.9896640826873385,
          "recall": 0.9140811455847255,
          "support": 419
        }
      },
      "primitive": "choice",
      "selective": [
        {
          "accepted": 480,
          "accuracy": 0.9166666666666666,
          "coverage": 1.0,
          "risk": 0.08333333333333337,
          "threshold": 0.0
        },
        {
          "accepted": 463,
          "accuracy": 0.9136069114470843,
          "coverage": 0.9645833333333333,
          "risk": 0.08639308855291572,
          "threshold": 0.5
        },
        {
          "accepted": 450,
          "accuracy": 0.9133333333333333,
          "coverage": 0.9375,
          "risk": 0.08666666666666667,
          "threshold": 0.6
        },
        {
          "accepted": 436,
          "accuracy": 0.9174311926605505,
          "coverage": 0.9083333333333333,
          "risk": 0.08256880733944949,
          "threshold": 0.7
        },
        {
          "accepted": 365,
          "accuracy": 0.9123287671232877,
          "coverage": 0.7604166666666666,
          "risk": 0.0876712328767123,
          "threshold": 0.8
        },
        {
          "accepted": 296,
          "accuracy": 0.9594594594594594,
          "coverage": 0.6166666666666667,
          "risk": 0.04054054054054057,
          "threshold": 0.9
        },
        {
          "accepted": 212,
          "accuracy": 1.0,
          "coverage": 0.44166666666666665,
          "risk": 0.0,
          "threshold": 0.95
        },
        {
          "accepted": 64,
          "accuracy": 1.0,
          "coverage": 0.13333333333333333,
          "risk": 0.0,
          "threshold": 0.99
        }
      ],
      "total_count": 480
    },
    "delivery_experience": {
      "accuracy": 0.7479166666666667,
      "brier": 0.07827022528149086,
      "ece": 0.06871137669741283,
      "evaluated_count": 480,
      "mae": 0.2846773433586235,
      "primitive": "score",
      "quadratic_weighted_kappa": 0.6427883070992612,
      "selective": [
        {
          "accepted": 480,
          "accuracy": 0.7479166666666667,
          "coverage": 1.0,
          "risk": 0.2520833333333333,
          "threshold": 0.0
        },
        {
          "accepted": 452,
          "accuracy": 0.7743362831858407,
          "coverage": 0.9416666666666667,
          "risk": 0.2256637168141593,
          "threshold": 0.5
        },
        {
          "accepted": 403,
          "accuracy": 0.8039702233250621,
          "coverage": 0.8395833333333333,
          "risk": 0.19602977667493793,
          "threshold": 0.6
        },
        {
          "accepted": 346,
          "accuracy": 0.846820809248555,
          "coverage": 0.7208333333333333,
          "risk": 0.15317919075144504,
          "threshold": 0.7
        },
        {
          "accepted": 310,
          "accuracy": 0.8741935483870967,
          "coverage": 0.6458333333333334,
          "risk": 0.12580645161290327,
          "threshold": 0.8
        },
        {
          "accepted": 195,
          "accuracy": 0.9692307692307692,
          "coverage": 0.40625,
          "risk": 0.03076923076923077,
          "threshold": 0.9
        },
        {
          "accepted": 133,
          "accuracy": 1.0,
          "coverage": 0.27708333333333335,
          "risk": 0.0,
          "threshold": 0.95
        },
        {
          "accepted": 70,
          "accuracy": 1.0,
          "coverage": 0.14583333333333334,
          "risk": 0.0,
          "threshold": 0.99
        }
      ],
      "total_count": 480
    },
    "explicit_repurchase_risk": {
      "accuracy": 0.9916666666666667,
      "auprc": null,
      "auroc": null,